{
  "routes": [
    {
      "id": "mashhad:route:line-1-main",
      "cityId": "mashhad",
      "lineId": "mashhad:line:1",
      "stops": [
        {
          "stationId": "mashhad:station:vakilabad",
          "status": "operational"
        },
        {
          "stationId": "mashhad:station:koohestan-park",
          "status": "operational"
        },
        {
          "stationId": "mashhad:station:namayeshgah",
          "status": "operational"
        },
        {
          "stationId": "mashhad:station:eghbal-e-lahouri",
          "status": "operational"
        },
        {
          "stationId": "mashhad:station:sayyad-e-shirazi",
          "status": "operational"
        },
        {
          "stationId": "mashhad:station:sadaf",
          "status": "operational"
        },
        {
          "stationId": "mashhad:station:haft-e-tir",
          "status": "operational"
        },
        {
          "stationId": "mashhad:station:danesh-amooz",
          "status": "operational"
        },
        {
          "stationId": "mashhad:station:seyyed-razi",
          "status": "operational"
        },
        {
          "stationId": "mashhad:station:kowsar",
          "status": "operational"
        },
        {
          "stationId": "mashhad:station:park-e-mellat",
          "status": "operational"
        },
        {
          "stationId": "mashhad:station:azadi",
          "status": "operational"
        },
        {
          "stationId": "mashhad:station:khayyam",
          "status": "operational"
        },
        {
          "stationId": "mashhad:station:palestine",
          "status": "operational"
        },
        {
          "stationId": "mashhad:station:taleghani",
          "status": "operational"
        },
        {
          "stationId": "mashhad:station:ghaem",
          "status": "operational"
        },
        {
          "stationId": "mashhad:station:shariati",
          "status": "operational"
        },
        {
          "stationId": "mashhad:station:imam-khomeini",
          "status": "operational"
        },
        {
          "stationId": "mashhad:station:basij",
          "status": "operational"
        },
        {
          "stationId": "mashhad:station:hefdah-e-shahrivar",
          "status": "operational"
        },
        {
          "stationId": "mashhad:station:parvin-etesami",
          "status": "operational"
        },
        {
          "stationId": "mashhad:station:ghadir",
          "status": "operational"
        },
        {
          "stationId": "mashhad:station:bustan-e-reyhaneh",
          "status": "operational"
        },
        {
          "stationId": "mashhad:station:airport",
          "status": "operational"
        }
      ]
    },
    {
      "id": "mashhad:route:line-2-main",
      "cityId": "mashhad",
      "lineId": "mashhad:line:2",
      "stops": [
        {
          "stationId": "mashhad:station:tabarsi",
          "status": "operational"
        },
        {
          "stationId": "mashhad:station:velayat",
          "status": "operational"
        },
        {
          "stationId": "mashhad:station:fajr",
          "status": "operational"
        },
        {
          "stationId": "mashhad:station:nabovvat",
          "status": "operational"
        },
        {
          "stationId": "mashhad:station:shahid-mofatteh",
          "status": "operational"
        },
        {
          "stationId": "mashhad:station:railway",
          "status": "operational"
        },
        {
          "stationId": "mashhad:station:shohada",
          "status": "operational"
        },
        {
          "stationId": "mashhad:station:saadi",
          "status": "operational"
        },
        {
          "stationId": "mashhad:station:shariati",
          "status": "operational"
        },
        {
          "stationId": "mashhad:station:alandasht",
          "status": "operational"
        },
        {
          "stationId": "mashhad:station:kouhsangi",
          "status": "operational"
        },
        {
          "stationId": "mashhad:station:shahid-kaveh",
          "status": "operational"
        },
        {
          "stationId": "mashhad:station:shahid-fakouri",
          "status": "operational"
        }
      ]
    },
    {
      "id": "mashhad:route:line-3-main",
      "cityId": "mashhad",
      "lineId": "mashhad:line:3",
      "stops": [
        {
          "stationId": "mashhad:station:imam-reza-terminal",
          "status": "operational"
        },
        {
          "stationId": "mashhad:station:basij",
          "status": "operational"
        },
        {
          "stationId": "mashhad:station:bab-al-javad",
          "status": "operational"
        },
        {
          "stationId": "mashhad:station:shohada",
          "status": "operational"
        }
      ]
    }
  ],
  "segments": [
    {
      "id": "mashhad:segment:line-1-vakilabad-koohestan-park",
      "cityId": "mashhad",
      "lineId": "mashhad:line:1",
      "routeId": "mashhad:route:line-1-main",
      "from": "mashhad:station:vakilabad",
      "to": "mashhad:station:koohestan-park",
      "status": "operational"
    },
    {
      "id": "mashhad:segment:line-1-koohestan-park-namayeshgah",
      "cityId": "mashhad",
      "lineId": "mashhad:line:1",
      "routeId": "mashhad:route:line-1-main",
      "from": "mashhad:station:koohestan-park",
      "to": "mashhad:station:namayeshgah",
      "status": "operational"
    },
    {
      "id": "mashhad:segment:line-1-namayeshgah-eghbal-e-lahouri",
      "cityId": "mashhad",
      "lineId": "mashhad:line:1",
      "routeId": "mashhad:route:line-1-main",
      "from": "mashhad:station:namayeshgah",
      "to": "mashhad:station:eghbal-e-lahouri",
      "status": "operational"
    },
    {
      "id": "mashhad:segment:line-1-eghbal-e-lahouri-sayyad-e-shirazi",
      "cityId": "mashhad",
      "lineId": "mashhad:line:1",
      "routeId": "mashhad:route:line-1-main",
      "from": "mashhad:station:eghbal-e-lahouri",
      "to": "mashhad:station:sayyad-e-shirazi",
      "status": "operational"
    },
    {
      "id": "mashhad:segment:line-1-sayyad-e-shirazi-sadaf",
      "cityId": "mashhad",
      "lineId": "mashhad:line:1",
      "routeId": "mashhad:route:line-1-main",
      "from": "mashhad:station:sayyad-e-shirazi",
      "to": "mashhad:station:sadaf",
      "status": "operational"
    },
    {
      "id": "mashhad:segment:line-1-sadaf-haft-e-tir",
      "cityId": "mashhad",
      "lineId": "mashhad:line:1",
      "routeId": "mashhad:route:line-1-main",
      "from": "mashhad:station:sadaf",
      "to": "mashhad:station:haft-e-tir",
      "status": "operational"
    },
    {
      "id": "mashhad:segment:line-1-haft-e-tir-danesh-amooz",
      "cityId": "mashhad",
      "lineId": "mashhad:line:1",
      "routeId": "mashhad:route:line-1-main",
      "from": "mashhad:station:haft-e-tir",
      "to": "mashhad:station:danesh-amooz",
      "status": "operational"
    },
    {
      "id": "mashhad:segment:line-1-danesh-amooz-seyyed-razi",
      "cityId": "mashhad",
      "lineId": "mashhad:line:1",
      "routeId": "mashhad:route:line-1-main",
      "from": "mashhad:station:danesh-amooz",
      "to": "mashhad:station:seyyed-razi",
      "status": "operational"
    },
    {
      "id": "mashhad:segment:line-1-seyyed-razi-kowsar",
      "cityId": "mashhad",
      "lineId": "mashhad:line:1",
      "routeId": "mashhad:route:line-1-main",
      "from": "mashhad:station:seyyed-razi",
      "to": "mashhad:station:kowsar",
      "status": "operational"
    },
    {
      "id": "mashhad:segment:line-1-kowsar-park-e-mellat",
      "cityId": "mashhad",
      "lineId": "mashhad:line:1",
      "routeId": "mashhad:route:line-1-main",
      "from": "mashhad:station:kowsar",
      "to": "mashhad:station:park-e-mellat",
      "status": "operational"
    },
    {
      "id": "mashhad:segment:line-1-park-e-mellat-azadi",
      "cityId": "mashhad",
      "lineId": "mashhad:line:1",
      "routeId": "mashhad:route:line-1-main",
      "from": "mashhad:station:park-e-mellat",
      "to": "mashhad:station:azadi",
      "status": "operational"
    },
    {
      "id": "mashhad:segment:line-1-azadi-khayyam",
      "cityId": "mashhad",
      "lineId": "mashhad:line:1",
      "routeId": "mashhad:route:line-1-main",
      "from": "mashhad:station:azadi",
      "to": "mashhad:station:khayyam",
      "status": "operational"
    },
    {
      "id": "mashhad:segment:line-1-khayyam-palestine",
      "cityId": "mashhad",
      "lineId": "mashhad:line:1",
      "routeId": "mashhad:route:line-1-main",
      "from": "mashhad:station:khayyam",
      "to": "mashhad:station:palestine",
      "status": "operational"
    },
    {
      "id": "mashhad:segment:line-1-palestine-taleghani",
      "cityId": "mashhad",
      "lineId": "mashhad:line:1",
      "routeId": "mashhad:route:line-1-main",
      "from": "mashhad:station:palestine",
      "to": "mashhad:station:taleghani",
      "status": "operational"
    },
    {
      "id": "mashhad:segment:line-1-taleghani-ghaem",
      "cityId": "mashhad",
      "lineId": "mashhad:line:1",
      "routeId": "mashhad:route:line-1-main",
      "from": "mashhad:station:taleghani",
      "to": "mashhad:station:ghaem",
      "status": "operational"
    },
    {
      "id": "mashhad:segment:line-1-ghaem-shariati",
      "cityId": "mashhad",
      "lineId": "mashhad:line:1",
      "routeId": "mashhad:route:line-1-main",
      "from": "mashhad:station:ghaem",
      "to": "mashhad:station:shariati",
      "status": "operational"
    },
    {
      "id": "mashhad:segment:line-1-shariati-imam-khomeini",
      "cityId": "mashhad",
      "lineId": "mashhad:line:1",
      "routeId": "mashhad:route:line-1-main",
      "from": "mashhad:station:shariati",
      "to": "mashhad:station:imam-khomeini",
      "status": "operational"
    },
    {
      "id": "mashhad:segment:line-1-imam-khomeini-basij",
      "cityId": "mashhad",